{
  "url": "https://www.example.com",
  "loggingEnabled": "example_value",
  "requireAcknowledgment": "example_value",
  "envelopeEvents": [],
  "recipientEvents": [],
  "includeCertificateOfCompletion": "example_value",
  "includeDocuments": "example_value",
  "includeDocumentFields": "example_value",
  "includeHMAC": "example_value",
  "includeSenderAccountAsCustomField": "example_value",
  "includeTimeZone": "example_value",
  "includeCertificateWithSoap": "example_value"
}